{
  "schema": "threenative.world",
  "version": "0.1.0",
  "entities": [
    {
      "id": "scene.root",
      "components": {
        "Transform": {
          "position": [0, 0, 0],
          "rotation": [0, 0, 0, 1],
          "scale": [1, 1, 1]
        }
      }
    },
    {
      "id": "cube.child",
      "components": {
        "Transform": {
          "position": [1, 0.5, 0],
          "rotation": [0, 0, 0, 1],
          "scale": [1, 1, 1]
        },
        "Hierarchy": {
          "parent": "scene.root"
        },
        "MeshRenderer": {
          "mesh": "mesh.cube",
          "material": "mat.cube"
        }
      }
    },
    {
      "id": "camera.main",
      "components": {
        "Transform": {
          "position": [0, 2, 5],
          "rotation": [0, 0, 0, 1],
          "scale": [1, 1, 1]
        },
        "Camera": {
          "kind": "perspective",
          "fovY": 60,
          "near": 0.1,
          "far": 100,
          "priority": 0
        }
      }
    },
    {
      "id": "capsule.actor",
      "components": {
        "Transform": {
          "position": [-1, 0.55, 0],
          "rotation": [0, 0, 0, 1],
          "scale": [1, 1, 1]
        },
        "Hierarchy": {
          "parent": "scene.root"
        },
        "MeshRenderer": {
          "mesh": "mesh.capsule",
          "material": "mat.cube"
        }
      }
    },
    {
      "id": "cylinder.actor",
      "components": {
        "Transform": {
          "position": [0, 0.6, -1],
          "rotation": [0, 0, 0, 1],
          "scale": [1, 1, 1]
        },
        "Hierarchy": {
          "parent": "scene.root"
        },
        "MeshRenderer": {
          "mesh": "mesh.cylinder",
          "material": "mat.cube"
        }
      }
    },
    {
      "id": "light.key",
      "components": {
        "Transform": {
          "position": [3, 4, 2],
          "rotation": [0, 0, 0, 1],
          "scale": [1, 1, 1]
        },
        "Light": {
          "kind": "directional",
          "color": "#ffffff",
          "intensity": 2
        }
      }
    }
  ],
  "resources": {
    "ActiveCamera": {
      "entity": "camera.main"
    }
  },
  "events": {},
  "prefabs": []
}
