{
  "schema": "threenative.world",
  "version": "0.1.0",
  "entities": [
    {
      "id": "camera.main",
      "components": {
        "Transform": {
          "position": [0, 1.2, 4],
          "rotation": [0, 0, 0, 1],
          "scale": [1, 1, 1]
        },
        "Camera": {
          "kind": "perspective",
          "fovY": 60,
          "near": 0.1,
          "far": 100,
          "priority": 0
        }
      }
    },
    {
      "id": "light.key",
      "components": {
        "Transform": {
          "position": [2, 4, 3],
          "rotation": [0, 0, 0, 1],
          "scale": [1, 1, 1]
        },
        "Light": {
          "kind": "directional",
          "color": "#ffffff",
          "intensity": 2
        }
      }
    },
    {
      "id": "player",
      "components": {
        "Transform": {
          "position": [0, 0, 0],
          "rotation": [0, 0, 0, 1],
          "scale": [1, 1, 1]
        },
        "MeshRenderer": {
          "mesh": "model.hero",
          "material": "mat.main"
        }
      }
    }
  ],
  "resources": {
    "AnimationReport": {}
  }
}
