{
  "entities": [
    {
      "components": {
        "Camera": {
          "far": 100,
          "fovY": 55,
          "kind": "perspective",
          "near": 0.1,
          "priority": 0
        },
        "Transform": {
          "position": [
            0,
            1.4,
            4.5
          ],
          "rotation": [
            0,
            0,
            0,
            1
          ],
          "scale": [
            1,
            1,
            1
          ]
        }
      },
      "id": "camera.main"
    },
    {
      "components": {
        "Light": {
          "color": "#ffffff",
          "intensity": 2,
          "kind": "directional"
        },
        "Transform": {
          "position": [
            3,
            4,
            2
          ],
          "rotation": [
            0,
            0,
            0,
            1
          ],
          "scale": [
            1,
            1,
            1
          ]
        }
      },
      "id": "light.key"
    },
    {
      "components": {
        "MeshRenderer": {
          "material": "mat.marker.sphere",
          "mesh": "mesh.marker.sphere"
        },
        "Transform": {
          "position": [
            1.4,
            -0.05,
            -0.7
          ],
          "rotation": [
            0,
            0,
            0,
            1
          ],
          "scale": [
            1,
            1,
            1
          ]
        }
      },
      "id": "marker.sphere"
    },
    {
      "components": {
        "MeshRenderer": {
          "material": "mat.player.box",
          "mesh": "mesh.player.box"
        },
        "Transform": {
          "position": [
            0,
            0.2,
            0
          ],
          "rotation": [
            0,
            0,
            0,
            1
          ],
          "scale": [
            1,
            1,
            1
          ]
        }
      },
      "id": "player.box"
    },
    {
      "components": {
        "MeshRenderer": {
          "material": "mat.world.floor",
          "mesh": "mesh.world.floor"
        },
        "Transform": {
          "position": [
            0,
            -0.5,
            0
          ],
          "rotation": [
            -0.7071067811865475,
            0,
            0,
            0.7071067811865476
          ],
          "scale": [
            1,
            1,
            1
          ]
        }
      },
      "id": "world.floor"
    }
  ],
  "events": {},
  "prefabs": [],
  "resources": {
    "ActiveCamera": {
      "entity": "camera.main"
    }
  },
  "schema": "threenative.world",
  "version": "0.1.0"
}
