{
  "schema": "threenative.world",
  "version": "0.1.0",
  "entities": [
    {
      "id": "camera.main",
      "components": {
        "Transform": {
          "position": [0, 2, 6],
          "rotation": [0, 0, 0, 1],
          "scale": [1, 1, 1]
        },
        "Camera": {
          "kind": "perspective",
          "fovY": 55,
          "near": 0.1,
          "far": 100,
          "priority": 0
        }
      }
    },
    {
      "id": "light.ambient",
      "components": {
        "Transform": {
          "position": [0, 0, 0],
          "rotation": [0, 0, 0, 1],
          "scale": [1, 1, 1]
        },
        "Light": {
          "kind": "ambient",
          "color": "#ffffff",
          "intensity": 0.8
        }
      }
    },
    {
      "id": "light.key",
      "components": {
        "Transform": {
          "position": [3, 6, 4],
          "rotation": [0, 0, 0, 1],
          "scale": [1, 1, 1]
        },
        "Light": {
          "kind": "directional",
          "color": "#ffffff",
          "intensity": 2
        }
      }
    }
  ],
  "resources": {
    "ActiveCamera": {
      "entity": "camera.main"
    }
  },
  "events": {},
  "prefabs": []
}
